{
  "schemaVersion": "1.0.0",
  "frameworkId": "ncom",
  "sourceCommit": "a350b576bbeae6c6254273037a17d2a8730fb80f",
  "generatedAt": "2026-07-28T03:27:49.734Z",
  "dimensions": [
    "evidenceValidity",
    "freshness",
    "typeCompleteness",
    "symbolReachability",
    "publicApiSupport",
    "workflowVerification",
    "ambiguity",
    "conflictStatus",
    "overallQuality"
  ],
  "records": [
    {
      "knowledgeId": "ncom-component-base-model",
      "evidenceCompleteness": "high",
      "scopeSpecificity": "high",
      "publicInternalSeparation": "high",
      "claimAtomicity": "high",
      "documentationSupport": "not_evidenced",
      "exampleSupport": "not_evidenced",
      "recipeValidation": "not_applicable",
      "runtimeValidation": "not_evidenced",
      "limitationCompleteness": "high",
      "freshness": "high",
      "duplication": "not_detected",
      "overallQuality": "high",
      "qualityWarnings": [],
      "publicationStatus": "published",
      "evidenceValidity": "high",
      "typeCompleteness": "high",
      "symbolReachability": "high",
      "publicApiSupport": "high",
      "workflowVerification": "not_applicable",
      "ambiguity": "high",
      "conflictStatus": "not_detected",
      "limitationsRecorded": true
    },
    {
      "knowledgeId": "ncom-event-state-update-workflow",
      "evidenceCompleteness": "high",
      "scopeSpecificity": "high",
      "publicInternalSeparation": "high",
      "claimAtomicity": "high",
      "documentationSupport": "not_evidenced",
      "exampleSupport": "not_evidenced",
      "recipeValidation": "low",
      "runtimeValidation": "not_evidenced",
      "limitationCompleteness": "high",
      "freshness": "high",
      "duplication": "not_detected",
      "overallQuality": "medium",
      "qualityWarnings": [
        "Recipe 未绑定运行验证，不能评为 high。"
      ],
      "publicationStatus": "published",
      "evidenceValidity": "high",
      "typeCompleteness": "high",
      "symbolReachability": "not_applicable",
      "publicApiSupport": "high",
      "workflowVerification": "not_applicable",
      "ambiguity": "high",
      "conflictStatus": "not_detected",
      "limitationsRecorded": true
    },
    {
      "knowledgeId": "ncom-event-system",
      "evidenceCompleteness": "high",
      "scopeSpecificity": "high",
      "publicInternalSeparation": "high",
      "claimAtomicity": "high",
      "documentationSupport": "not_evidenced",
      "exampleSupport": "not_evidenced",
      "recipeValidation": "not_applicable",
      "runtimeValidation": "not_evidenced",
      "limitationCompleteness": "high",
      "freshness": "high",
      "duplication": "not_detected",
      "overallQuality": "high",
      "qualityWarnings": [],
      "publicationStatus": "published",
      "evidenceValidity": "high",
      "typeCompleteness": "high",
      "symbolReachability": "high",
      "publicApiSupport": "high",
      "workflowVerification": "not_applicable",
      "ambiguity": "high",
      "conflictStatus": "not_detected",
      "limitationsRecorded": true
    },
    {
      "knowledgeId": "ncom-example-workflow",
      "evidenceCompleteness": "high",
      "scopeSpecificity": "high",
      "publicInternalSeparation": "high",
      "claimAtomicity": "high",
      "documentationSupport": "not_evidenced",
      "exampleSupport": "not_evidenced",
      "recipeValidation": "low",
      "runtimeValidation": "not_evidenced",
      "limitationCompleteness": "high",
      "freshness": "high",
      "duplication": "not_detected",
      "overallQuality": "medium",
      "qualityWarnings": [
        "Recipe 未绑定运行验证，不能评为 high。"
      ],
      "publicationStatus": "published",
      "evidenceValidity": "high",
      "typeCompleteness": "high",
      "symbolReachability": "not_applicable",
      "publicApiSupport": "high",
      "workflowVerification": "medium",
      "ambiguity": "high",
      "conflictStatus": "not_detected",
      "limitationsRecorded": true
    },
    {
      "knowledgeId": "ncom-family-closable-feedback-overlay",
      "evidenceCompleteness": "high",
      "scopeSpecificity": "high",
      "publicInternalSeparation": "high",
      "claimAtomicity": "high",
      "documentationSupport": "not_evidenced",
      "exampleSupport": "not_evidenced",
      "recipeValidation": "not_applicable",
      "runtimeValidation": "not_evidenced",
      "limitationCompleteness": "high",
      "freshness": "high",
      "duplication": "not_detected",
      "overallQuality": "high",
      "qualityWarnings": [],
      "publicationStatus": "published",
      "evidenceValidity": "high",
      "typeCompleteness": "high",
      "symbolReachability": "high",
      "publicApiSupport": "high",
      "workflowVerification": "not_applicable",
      "ambiguity": "high",
      "conflictStatus": "not_detected",
      "limitationsRecorded": true
    },
    {
      "knowledgeId": "ncom-family-input-controls",
      "evidenceCompleteness": "high",
      "scopeSpecificity": "high",
      "publicInternalSeparation": "high",
      "claimAtomicity": "high",
      "documentationSupport": "not_evidenced",
      "exampleSupport": "not_evidenced",
      "recipeValidation": "not_applicable",
      "runtimeValidation": "not_evidenced",
      "limitationCompleteness": "high",
      "freshness": "high",
      "duplication": "not_detected",
      "overallQuality": "high",
      "qualityWarnings": [],
      "publicationStatus": "published",
      "evidenceValidity": "high",
      "typeCompleteness": "high",
      "symbolReachability": "high",
      "publicApiSupport": "high",
      "workflowVerification": "not_applicable",
      "ambiguity": "high",
      "conflictStatus": "not_detected",
      "limitationsRecorded": true
    },
    {
      "knowledgeId": "ncom-family-reference-popup",
      "evidenceCompleteness": "high",
      "scopeSpecificity": "high",
      "publicInternalSeparation": "high",
      "claimAtomicity": "high",
      "documentationSupport": "not_evidenced",
      "exampleSupport": "not_evidenced",
      "recipeValidation": "not_applicable",
      "runtimeValidation": "not_evidenced",
      "limitationCompleteness": "high",
      "freshness": "high",
      "duplication": "not_detected",
      "overallQuality": "high",
      "qualityWarnings": [],
      "publicationStatus": "published",
      "evidenceValidity": "high",
      "typeCompleteness": "high",
      "symbolReachability": "high",
      "publicApiSupport": "high",
      "workflowVerification": "not_applicable",
      "ambiguity": "high",
      "conflictStatus": "not_detected",
      "limitationsRecorded": true
    },
    {
      "knowledgeId": "ncom-lifecycle-callback-structure",
      "evidenceCompleteness": "high",
      "scopeSpecificity": "high",
      "publicInternalSeparation": "high",
      "claimAtomicity": "high",
      "documentationSupport": "not_evidenced",
      "exampleSupport": "not_evidenced",
      "recipeValidation": "not_applicable",
      "runtimeValidation": "not_evidenced",
      "limitationCompleteness": "high",
      "freshness": "high",
      "duplication": "not_detected",
      "overallQuality": "high",
      "qualityWarnings": [],
      "publicationStatus": "published",
      "evidenceValidity": "high",
      "typeCompleteness": "high",
      "symbolReachability": "not_applicable",
      "publicApiSupport": "high",
      "workflowVerification": "not_applicable",
      "ambiguity": "high",
      "conflictStatus": "not_detected",
      "limitationsRecorded": true
    },
    {
      "knowledgeId": "ncom-ncalert-structure",
      "evidenceCompleteness": "high",
      "scopeSpecificity": "high",
      "publicInternalSeparation": "high",
      "claimAtomicity": "high",
      "documentationSupport": "not_evidenced",
      "exampleSupport": "not_evidenced",
      "recipeValidation": "not_applicable",
      "runtimeValidation": "not_evidenced",
      "limitationCompleteness": "high",
      "freshness": "high",
      "duplication": "not_detected",
      "overallQuality": "high",
      "qualityWarnings": [],
      "publicationStatus": "published",
      "evidenceValidity": "high",
      "typeCompleteness": "high",
      "symbolReachability": "high",
      "publicApiSupport": "high",
      "workflowVerification": "not_applicable",
      "ambiguity": "high",
      "conflictStatus": "not_detected",
      "limitationsRecorded": true
    },
    {
      "knowledgeId": "ncom-ncbutton-api",
      "evidenceCompleteness": "high",
      "scopeSpecificity": "high",
      "publicInternalSeparation": "high",
      "claimAtomicity": "high",
      "documentationSupport": "not_evidenced",
      "exampleSupport": "not_evidenced",
      "recipeValidation": "not_applicable",
      "runtimeValidation": "not_evidenced",
      "limitationCompleteness": "high",
      "freshness": "high",
      "duplication": "not_detected",
      "overallQuality": "high",
      "qualityWarnings": [],
      "publicationStatus": "published",
      "evidenceValidity": "high",
      "typeCompleteness": "high",
      "symbolReachability": "high",
      "publicApiSupport": "high",
      "workflowVerification": "not_applicable",
      "ambiguity": "high",
      "conflictStatus": "not_detected",
      "limitationsRecorded": true
    },
    {
      "knowledgeId": "ncom-nccard-structure",
      "evidenceCompleteness": "high",
      "scopeSpecificity": "high",
      "publicInternalSeparation": "high",
      "claimAtomicity": "high",
      "documentationSupport": "not_evidenced",
      "exampleSupport": "not_evidenced",
      "recipeValidation": "not_applicable",
      "runtimeValidation": "not_evidenced",
      "limitationCompleteness": "high",
      "freshness": "high",
      "duplication": "not_detected",
      "overallQuality": "high",
      "qualityWarnings": [],
      "publicationStatus": "published",
      "evidenceValidity": "high",
      "typeCompleteness": "high",
      "symbolReachability": "high",
      "publicApiSupport": "high",